{
  "schema_version": "0.1",
  "event_id": "0f1e2d3c-4b5a-4968-8776-655443322110",
  "message_type": "command_result",
  "station_id": "station-sim-01",
  "source_timestamp": "2026-10-14T18:05:02Z",
  "payload": {
    "command_id": "5a4b3c2d-1e0f-4a9b-8c7d-6e5f4a3b2c1d",
    "state": "applied",
    "applied_fps": 5
  }
}
