{
  "schema_version": "0.1",
  "event_id": "aa11bb22-cc33-4d44-8e55-ff6677889900",
  "message_type": "ack",
  "station_id": "station-sim-01",
  "source_timestamp": "2026-10-14T18:00:02Z",
  "payload": {
    "results": [
      { "event_id": "3f0e8c2a-6d1b-4b7e-9a51-0c2d4e6f8a10", "status": "stored" },
      { "event_id": "8b6c1f44-2e0a-4c5d-8f3e-7a9b0c1d2e3f", "status": "duplicate" }
    ]
  }
}
