{
  "schema_version": "0.1",
  "event_id": "3f0e8c2a-6d1b-4b7e-9a51-0c2d4e6f8a10",
  "message_type": "telemetry",
  "station_id": "station-sim-01",
  "source_timestamp": "2026-10-14T18:00:00Z",
  "sequence": 42,
  "payload": {
    "cpu_percent": 63.5,
    "memory_percent": 41.2,
    "temperature_c": 61.0,
    "inference_latency_ms": 85.3,
    "processing_fps": 8.0,
    "network_status": "connected",
    "camera_status": "ok",
    "video_source_type": "file",
    "active_model_version": "example-model-0.0.0"
  }
}
